Foundation Layer/Ontology Generator/output/ceAPRDataElementRef.csv

"";"dataDictionaryName";"dataElementNumber";"IncludedinCEAPR"
"1";"CurrentEdStatus";"C3";"No"
"2";"MostRecentEdStatus";"C3";"No"
"3";"CurrentSchoolAttend";"C3";"No"
"4";"ReferralResult";"4.20";"Yes"
"5";"ReferralCaseManageAfter";"4.20";"Yes"
"6";"ProbSolDivRRResult";"4.20";"Yes"
"7";"Event";"4.20";"Yes"
"8";"PrioritizationStatus";"4.19";"Yes"
"9";"AssessmentLevel";"4.19";"Yes"
"10";"AssessmentType";"4.19";"Yes"
"11";"MovedTwoOrMore";"4.12";"No"
"12";"LeaseOwn60Day";"4.12";"No"
"13";"ResourcesToObtain";"4.12";"No"
"14";"SubsequentResidence";"4.12";"No"
"15";"LeaveSituation14Days";"4.12";"No"
"16";"CLSSubsidyType";"4.12";"No"
"17";"CurrentLivingSituation";"4.12";"No"
"18";"ReferralOutcome";"P2";"No"
"19";"AntiRetroviral";"W6";"No"
"20";"ViralLoadSource";"W4";"No"
"21";"ViralLoadAvailable";"W4";"No"
"22";"TCellSource";"W4";"No"
"23";"TCellCountAvailable";"W4";"No"
"24";"NotEmployedReason";"R6";"No"
"25";"EmploymentType";"R6";"No"
"26";"Employed";"R6";"No"
"27";"SchoolStatus";"R5";"No"
"28";"LastGradeCompleted";"R4";"No"
"29";"PregnancyStatus";"R10";"No"
"30";"MentalHealthStatus";"R9";"No"
"31";"DentalHealthStatus";"R8";"No"
"32";"GeneralHealthStatus";"R7";"No"
"33";"CurrentlyFleeing";"4.11";"No"
"34";"WhenOccurred";"4.11";"No"
"35";"DomesticViolenceSurvivor";"4.11";"No"
"36";"ConnectionWithSOAR";"P4";"No"
"37";"NoRyanWhiteReason";"W3";"No"
"38";"RyanWhiteMedDent";"W3";"No"
"39";"NoADAPReason";"W3";"No"
"40";"ADAP";"W3";"No"
"41";"OtherInsurance";"4.04";"No"
"42";"NoIndianHealthServicesReason";"4.04";"No"
"43";"IndianHealthServices";"4.04";"No"
"44";"NoStateHealthInsReason";"4.04";"No"
"45";"StateHealthIns";"4.04";"No"
"46";"NoPrivatePayReason";"4.04";"No"
"47";"PrivatePay";"4.04";"No"
"48";"NoCOBRAReason";"4.04";"No"
"49";"COBRA";"4.04";"No"
"50";"NoEmployerProvidedReason";"4.04";"No"
"51";"EmployerProvided";"4.04";"No"
"52";"NoVHAReason";"4.04";"No"
"53";"VHAServices";"4.04";"No"
"54";"NoSCHIPReason";"4.04";"No"
"55";"SCHIP";"4.04";"No"
"56";"NoMedicareReason";"4.04";"No"
"57";"Medicare";"4.04";"No"
"58";"NoMedicaidReason";"4.04";"No"
"59";"Medicaid";"4.04";"No"
"60";"InsuranceFromAnySource";"4.04";"No"
"61";"OtherBenefitsSource";"4.03";"No"
"62";"OtherTANF";"4.03";"No"
"63";"TANFTransportation";"4.03";"No"
"64";"TANFChildCare";"4.03";"No"
"65";"WIC";"4.03";"No"
"66";"SNAP";"4.03";"No"
"67";"BenefitsFromAnySource";"4.03";"No"
"68";"OtherIncomeSource";"4.02";"No"
"69";"Alimony";"4.02";"No"
"70";"ChildSupport";"4.02";"No"
"71";"Pension";"4.02";"No"
"72";"SocSecRetirement";"4.02";"No"
"73";"GA";"4.02";"No"
"74";"TANF";"4.02";"No"
"75";"WorkersComp";"4.02";"No"
"76";"PrivateDisability";"4.02";"No"
"77";"VADisabilityNonService";"4.02";"No"
"78";"VADisabilityService";"4.02";"No"
"79";"SSDI";"4.02";"No"
"80";"SSI";"4.02";"No"
"81";"Unemployment";"4.02";"No"
"82";"Earned";"4.02";"No"
"83";"IncomeFromAnySource";"4.02";"No"
"84";"CMExitReason";"V9";"No"
"85";"InPersonGroup";"R20";"No"
"86";"InPersonIndividual";"R20";"No"
"87";"Telephone";"R20";"No"
"88";"EmailSocialMedia";"R20";"No"
"89";"AftercareProvided";"R20";"No"
"90";"PosCommunityConnections";"R19";"No"
"91";"PosPeerConnections";"R19";"No"
"92";"PosAdultConnections";"R19";"No"
"93";"DestinationSafeWorker";"R19";"No"
"94";"DestinationSafeClient";"R19";"No"
"95";"PostExitCounselingPlan";"R18";"No"
"96";"GroupCounseling";"R18";"No"
"97";"FamilyCounseling";"R18";"No"
"98";"IndividualCounseling";"R18";"No"
"99";"CounselingReceived";"R18";"No"
"100";"LaborExploitPastThreeMonths";"R16";"No"
"101";"CoercedToContinueWork";"R16";"No"
"102";"WorkplacePromiseDifference";"R16";"No"
"103";"WorkplaceViolenceThreats";"R16";"No"
"104";"AskedOrForcedToExchangeForSexPastThreeMonths";"R15";"No"
"105";"AskedOrForcedToExchangeForSex";"R15";"No"
"106";"CountOfExchangeForSex";"R15";"No"
"107";"ExchangeForSexPastThreeMonths";"R15";"No"
"108";"ExchangeForSex";"R15";"No"
"109";"EarlyExitReason";"R17";"No"
"110";"ProjectCompletionStatus";"R17";"No"
"111";"SubsidyInformation";"W5";"No"
"112";"SubsidyInformation";"W5";"No"
"113";"DestinationSubsidyType";"3.12";"No"
"114";"Destination";"3.12";"No"
"115";"TranslationNeeded";"C4";"No"
"116";"MentalHealthConsultation";"V10";"No"
"117";"CoCPrioritized";"V7";"No"
"118";"HH5Plus";"V7";"No"
"119";"DependentUnder6";"V7";"No"
"120";"SingleParent";"V7";"No"
"121";"CurrentPregnant";"V7";"No"
"122";"DisabledHoH";"V7";"No"
"123";"SexOffender";"V7";"No"
"124";"PrisonDischarge";"V7";"No"
"125";"IncarceratedAdult";"V7";"No"
"126";"CriminalRecord";"V7";"No"
"127";"EvictionHistory";"V7";"No"
"128";"SubsidyAtRisk";"V7";"No"
"129";"HOHLeaseholder";"V7";"No"
"130";"ClientLeaseholder";"V7";"No"
"131";"LiteralHomelessHistory";"V7";"No"
"132";"AnnualPercentAMI";"V7";"No"
"133";"TimeToHousingLoss";"V7";"No"
"134";"TargetScreenReqd";"V7";"No"
"135";"VAMCStation";"V6";"No"
"136";"IncarceratedParent";"R13";"No"
"137";"InsufficientIncome";"R13";"No"
"138";"AlcoholDrugUseDisorderFam";"R13";"No"
"139";"PhysicalDisabilityFam";"R13";"No"
"140";"MentalHealthDisorderFam";"R13";"No"
"141";"UnemploymentFam";"R13";"No"
"142";"JuvenileJusticeYears";"R12";"No"
"143";"FormerWardJuvenileJustice";"R12";"No"
"144";"ChildWelfareYears";"R11";"No"
"145";"FormerWardChildWelfare";"R11";"No"
"146";"RunawayYouth";"R2";"No"
"147";"ReasonNoServices";"R2";"No"
"148";"EligibleForRHY";"R2";"No"
"149";"ReferralSource";"R1";"No"
"150";"PercentAMI";"V4";"No"
"151";"ReasonNotEnrolled";"P3";"No"
"152";"ClientEnrolledInPATH";"P3";"No"
"153";"DisablingCondition";"3.08";"No"
"154";"MonthsHomelessPastThreeYears";"3.917";"No"
"155";"TimesHomelessPastThreeYears";"3.917";"No"
"156";"PreviousStreetESSH";"3.917";"No"
"157";"LOSUnderThreshold";"3.917";"No"
"158";"LOSUnderThreshold";"3.917";"No"
"159";"LengthOfStay";"3.917";"No"
"160";"RentalSubsidyType";"3.917";"No"
"161";"LivingSituation";"3.917";"No"
"162";"RelationshipToHoH";"3.15";"Yes"
"163";"DischargeStatus";"V1";"No"
"164";"MilitaryBranch";"V1";"No"
"165";"OtherTheater";"V1";"No"
"166";"IraqOND";"V1";"No"
"167";"IraqOIF";"V1";"No"
"168";"AfghanistanOEF";"V1";"No"
"169";"DesertStorm";"V1";"No"
"170";"VietnamWar";"V1";"No"
"171";"KoreanWar";"V1";"No"
"172";"WorldWarII";"V1";"No"
"173";"VeteranStatus";"3.07";"Yes"
"174";"RaceNone";"3.04";"No"
"175";"White";"3.04";"No"
"176";"NativeHIPacific";"3.04";"No"
"177";"MidEastNAfrican";"3.04";"No"
"178";"HispanicLatinao";"3.04";"No"
"179";"BlackAfAmerican";"3.04";"No"
"180";"Asian";"3.04";"No"
"181";"AmIndAKNative";"3.04";"No"
"182";"Sex";"4.21";"No"
"183";"DOBDataQuality";"3.03";"No"
"184";"SSNDataQuality";"3.02";"No"
"185";"NameDataQuality";"3.01";"No"
"186";"ReceivesReferrals";"2.09";"No"
"187";"DirectServices";"2.09";"No"
"188";"HousingAssessment";"W5";"No"
"189";"HousingAssessment";"W5";"No"
"190";"HousingAssessment";"2.09";"Yes"
"191";"HousingAssessment";"2.09";"No"
"192";"CrisisAssessment";"2.09";"No"
"193";"PreventionAssessment";"2.09";"No"
"194";"AccessPoint";"2.09";"Yes"
"195";"HMISParticipationType";"2.08";"No"
"196";"ESBedType";"2.07";"No"
"197";"Availability";"2.07";"No"
"198";"HouseholdType";"2.07";"No"
"199";"GeographyType";"2.03";"No"
"200";"Funder";"2.06";"No"
"201";"HOPWAMedAssistedLivingFac";"2.02";"No"
"202";"TargetPopulation";"2.02";"No"
"203";"ResidentialAffiliation";"2.02";"No"
"204";"RRHSubType";"2.02";"No"
"205";"HousingType";"2.02";"No"
"206";"ProjectType";"2.02";"Yes"
"207";"ContinuumProject";"2.02";"No"
"208";"VictimServiceProvider";"2.01";"Yes"
"209";"ResultDate";"4.20";"No"
"210";"LocationCrisisOrPHHousing";"4.20";"No"
"211";"EventDate";"4.20";"No"
"212";"AssessmentResult";"4.19";"No"
"213";"AssessmentResultType";"4.19";"No"
"214";"AssessmentAnswer";"4.19";"No"
"215";"AssessmentQuestion";"4.19";"No"
"216";"AssessmentLocation";"4.19";"No"
"217";"AssessmentDate";"4.19";"Yes"
"218";"LocationDetails";"4.12";"No"
"219";"VerifiedBy";"4.12";"No"
"220";"ExportID";"FW";"No"
"221";"FAEndDate";"V3";"No"
"222";"FAStartDate";"V3";"No"
"223";"FAAmount";"V3";"No"
"224";"FAAmount";"W2";"No"
"225";"SubTypeProvided";"V2";"No"
"226";"SubTypeProvided";"V2";"No"
"227";"SubTypeProvided";"V2";"No"
"228";"MovingOnOtherType";"C2";"No"
"229";"OtherTypeProvided";"V8";"No"
"230";"OtherTypeProvided";"V8";"No"
"231";"OtherTypeProvided";"V2";"No"
"232";"OtherTypeProvided";"V2";"No"
"233";"ViralLoad";"W4";"No"
"234";"TCellCount";"W4";"No"
"235";"DueDate";"R10";"No"
"236";"InformationDate";"C3";"No"
"237";"InformationDate";"4.12";"No"
"238";"InformationDate";"R6";"No"
"239";"InformationDate";"4.11";"No"
"240";"OtherInsuranceIdentify";"4.04";"No"
"241";"OtherBenefitsSourceIdentify";"4.03";"No"
"242";"OtherIncomeSourceIdentify";"4.02";"No"
"243";"OtherIncomeAmount";"4.02";"No"
"244";"AlimonyAmount";"4.02";"No"
"245";"ChildSupportAmount";"4.02";"No"
"246";"PensionAmount";"4.02";"No"
"247";"SocSecRetirementAmount";"4.02";"No"
"248";"GAAmount";"4.02";"No"
"249";"TANFAmount";"4.02";"No"
"250";"WorkersCompAmount";"4.02";"No"
"251";"PrivateDisabilityAmount";"4.02";"No"
"252";"VADisabilityNonServiceAmount";"4.02";"No"
"253";"VADisabilityServiceAmount";"4.02";"No"
"254";"SSDIAmount";"4.02";"No"
"255";"SSIAmount";"4.02";"No"
"256";"UnemploymentAmount";"4.02";"No"
"257";"EarnedAmount";"4.02";"No"
"258";"TotalMonthlyIncome";"4.02";"No"
"259";"AftercareDate";"R20";"No"
"260";"SessionsInPlan";"R18";"No"
"261";"SessionCountAtExit";"R18";"No"
"262";"OtherDestination";"3.12";"No"
"263";"ExitDate";"3.11";"Yes"
"264";"PreferredLanguageDifferent";"C4";"No"
"265";"PreferredLanguage";"C4";"No"
"266";"ThresholdScore";"V7";"No"
"267";"HPScreeningScore";"V7";"No"
"268";"JuvenileJusticeMonths";"R12";"No"
"269";"ChildWelfareMonths";"R11";"No"
"270";"DateOfBCPStatus";"R2";"No"
"271";"CountOutreachReferralApproaches";"R1";"No"
"272";"DateOfPATHStatus";"P3";"No"
"273";"MoveInDate";"3.20";"No"
"274";"DateOfEngagement";"4.13";"No"
"275";"DateToStreetESSH";"3.917";"No"
"276";"EnrollmentCoC";"3.16";"No"
"277";"HouseholdID";"5.09";"No"
"278";"EntryDate";"3.10";"Yes"
"279";"EnrollmentID";"5.06";"No"
"280";"YearSeparated";"V1";"No"
"281";"YearEnteredService";"V1";"No"
"282";"AdditionalRaceEthnicity";"3.04";"No"
"283";"DOB";"3.03";"Yes"
"284";"SSN[1]";"3.02";"No"
"285";"NameSuffix";"3.01";"No"
"286";"LastName";"3.01";"No"
"287";"MiddleName";"3.01";"No"
"288";"FirstName";"3.01";"No"
"289";"PersonalID";"5.08";"No"
"290";"CEParticipationStatusEndDate";"2.09";"No"
"291";"CEParticipationStatusStartDate";"2.09";"No"
"292";"HMISParticipationStatusEndDate";"2.08";"No"
"293";"HMISParticipationStatusStartDate";"2.08";"No"
"294";"ResProjectID";"2.02";"No"
"295";"InventoryEndDate";"2.07";"No"
"296";"InventoryStartDate";"2.07";"No"
"297";"OtherBedInventory";"2.07";"No"
"298";"CHBedInventory";"2.07";"No"
"299";"YouthBedInventory";"2.07";"No"
"300";"CHYouthBedInventory";"2.07";"No"
"301";"VetBedInventory";"2.07";"No"
"302";"YouthVetBedInventory";"2.07";"No"
"303";"CHVetBedInventory";"2.07";"No"
"304";"BedInventory";"2.07";"No"
"305";"UnitInventory";"2.07";"No"
"306";"ZIP";"2.03";"No"
"307";"State";"2.03";"No"
"308";"City";"2.03";"No"
"309";"Address2";"2.03";"No"
"310";"Address1";"2.03";"No"
"311";"Geocode";"2.03";"Yes"
"312";"CoCCode";"2.07";"No"
"313";"CoCCode";"2.07";"No"
"314";"CoCCode";"2.03";"No"
"315";"CoCCode";"2.03";"Yes"
"316";"EndDate";"2.06";"No"
"317";"StartDate";"2.06";"No"
"318";"GrantID";"2.06";"No"
"319";"OtherFunder";"2.06";"No"
"320";"OperatingEndDate";"2.02";"No"
"321";"OperatingStartDate";"2.02";"No"
"322";"ProjectName";"2.02";"Yes"
"323";"ProjectID";"2.02";"Yes"
"324";"UserID";"5.07";"No"
"325";"OrganizationName";"2.01";"Yes"
"326";"OrganizationID";"2.01";"Yes"

app/shiny/data/DataDictionaryAnnotations.md

## 2.02 Project Information

- **Element Type:** Project Descriptor
- **Funder: Program-Component:** All Programs - All Components
- **Project Type Applicability:** All HMIS Project Types
- **Data Collected About:** All Projects
- **Collection Point:** Initial HMIS project setup, reviewed/updated no less than annually
- **System Logic and Other System Issues:** Projects funded with 2.06 Funding Source HUD: Pay for Success (35) and do not provide
- **CSV:** `Project and Affiliation`
- **Rationale:** To identify each project entering data into HMIS, as well as any residential continuum projects not participating in HMIS; and to associate each project with the specific type of lodging or services provided and the details about those project types. The 'Project ID' is used to link project descriptor information in other data elements to the specific project, and to link clients and their enrollment data to the project. Data related to project type is necessary to identify corresponding data collection requirements and for reporting purposes. The element also identifies whether the project is a continuum project, Rapid Re-Housing subtypes, and the relationship of a 'Services Only' project (or RRH: Services Only subtype) to a housing project as necessary. Finally, HOPWA-funded projects identify whether they are 'Medically Assisted Living Facilities' at this stage of project setup.
- **Data Collection Instruction:** <https://www.hudexchange.info/programs/hmis/hmis-data-standards/standards/project-descriptor-data-elements/202-project-information/>

## 2.03 Continuum of Care Information

- **Element Type:** Project Descriptor
- **Funder: Program-Component:** All Programs - All Components
- **Project Type Applicability:** All HMIS Project Types
- **Data Collected About:** All Continuum Projects
- **Collection Point:** Initial HMIS project setup, reviewed/updated no less than annually
- **System Logic and Other System Issues:** There is a many-to-one relationship between this data element and 2.02 Project Information; there
- **CSV:** `ProjectCoC`
- **Rationale:** To associate each project entering data into HMIS, as well as any residential continuum projects not participating in HMIS, with one or more Continuum of Care (CoC) for reporting and data exchange purposes.
- **Data Collection Instruction:** <https://www.hudexchange.info/programs/hmis/hmis-data-standards/standards/project-descriptor-data-elements/203-continuum-of-care-information/>

## 3.10 Project Start Date

- **Element Type:** Universal
- **Funder: Program-Component:** All Programs - All Components
- **Project Type Applicability:** All HMIS Project Types
- **Data Collected About:** All Clients
- **Collection Point:** Project Start
- **System Logic and Other System Issues:** The "project start date" must be exportable in the [date field] format.
- **CSV:** `Enrollment`
- **Rationale:** To determine the start of each client's period of participation with a project. All projects need this data element for reporting time spent participating in the project by a given client. Paired with 3.20 ‘Housing Move-In Date’, it becomes possible to determine the length of time from project start to housing placement for all clients accessing permanent housing.
- **Data Collection Instruction:** <https://www.hudexchange.info/programs/hmis/hmis-data-standards/standards/universal-data-elements/310-project-start-date/>

## 3.15 Relationship to Head of Household

- **Element Type:** Universal
- **Funder: Program-Component:** All Programs - All Components
- **Project Type Applicability:** All HMIS Project Types
- **Data Collected About:** All Clients
- **Collection Point:** Project Start
- **System Logic and Other System Issues:** There must be exactly one Head of Household for each household (3.15
- **CSV:** `Enrollment`
- **Rationale:** To identify one person to whom all other household members can be linked to at the time they enter a project. This facilitates the identification and enumeration of households. In addition, specifying the relationship of household members to the Head of Household facilitates reporting on household composition.
- **Data Collection Instruction:** <https://www.hudexchange.info/programs/hmis/hmis-data-standards/standards/universal-data-elements/315-relationship-to-head-of-household/>

## 3.917A Prior Living Situation (A)

- **Element Type:** Universal
- **Funder: Program-Component:** All Programs - All Components which are typed as Street Outreach, Emergency Shelter - Entry Exit,
- **Project Type Applicability:** 0: Emergency Shelter - Entry Exit 1: Emergency Shelter - Night-by-Night 4: Street Outreach 8: Safe Haven
- **Data Collected About:** Head of Household and Adults
- **Collection Point:** Project Start Relationship to No more than one Living Situation per Enrollment Enrollment ID (an enrollment)
- **System Logic and Other System Issues:** This data element, 3.917A is required for all projects which are typed in an HMIS as Emergency
- **CSV:** `Enrollment`
- **Rationale:** To identify the type of living situation and length of stay in that situation immediately prior to project start for all adults and the Head of Household. This data element is used with other information to identify whether a client appears to meet the criteria for experiencing chronic homelessness at various points of enrollment (i.e., at the point of project entry, at a point during a project enrollment, or at any point over the course of a specified reporting period).
- **Data Collection Instruction:** <https://www.hudexchange.info/programs/hmis/hmis-data-standards/standards/universal-data-elements/3917-prior-living-situation/>

## 3.917B Prior Living Situation (B)

- **Element Type:** Universal
- **Funder: Program-Component:** All Programs - All Components
- **Project Type Applicability:** 2: Transitional Housing 3: PH - Permanent Supportive Housing (disability required for entry) 6: Services Only 7: Other 9: PH - Housing Only 10: PH - Housing with Services (no disability required for entry) 11: Day Shelter 12: Homelessness Prevention 13: PH - Rapid Re-Housing 14: Coordinated Entry
- **Data Collected About:** Head of Household and Adults
- **Collection Point:** Project Start
- **System Logic and Other System Issues:** This data element, 3.917B, is required for all project types in an HMIS other than Emergency Shelter
- **CSV:** `Enrollment`
- **Rationale:** To identify the type of living situation and length of stay in that situation immediately prior to project start for all adults and the Head of Household. This data element is used with other information to identify whether a client appears to meet the criteria for experiencing chronic homelessness at various points of enrollment (i.e., at the point of project entry, at a point during a project enrollment, or at any point over the course of a specified reporting period).
- **Data Collection Instruction:** <https://www.hudexchange.info/programs/hmis/hmis-data-standards/standards/universal-data-elements/3917-prior-living-situation/>